{
  "template": "auth.invitation",
  "to": {
    "email": "anna@acme.pl",
    "name": "Anna Nowak",
    "user_id": null
  },
  "locale": "pl",
  "data": {
    "organisation": "Acme Sp. z o.o.",
    "link": "https://auth.abeon.pl/invitation/9f3c",
    "expires_at": "2026-09-25T12:00:00+00:00"
  },
  "idempotency_key": "auth.invitation:1842"
}
